{
  "chunk_id": "chunk:5:4",
  "layers": {
    "biome": [
      [
        19,
        2432
      ],
      [
        11,
        1
      ],
      [
        19,
        63
      ],
      [
        11,
        2
      ],
      [
        19,
        62
      ],
      [
        11,
        2
      ],
      [
        19,
        62
      ],
      [
        11,
        2
      ],
      [
        19,
        62
      ],
      [
        11,
        1
      ],
      [
        19,
        1407
      ]
    ],
    "build": [
      [
        1,
        3390
      ],
      [
        0,
        2
      ],
      [
        1,
        57
      ],
      [
        0,
        7
      ],
      [
        1,
        54
      ],
      [
        0,
        10
      ],
      [
        1,
        49
      ],
      [
        0,
        15
      ],
      [
        1,
        46
      ],
      [
        0,
        13
      ],
      [
        1,
        46
      ],
      [
        0,
        15
      ],
      [
        1,
        46
      ],
      [
        0,
        13
      ],
      [
        1,
        46
      ],
      [
        0,
        15
      ],
      [
        1,
        46
      ],
      [
        0,
        13
      ],
      [
        1,
        46
      ],
      [
        0,
        15
      ],
      [
        1,
        46
      ],
      [
        0,
        13
      ],
      [
        1,
        46
      ],
      [
        0,
        15
      ],
      [
        1,
        32
      ]
    ],
    "elevation_band": [
      [
        8,
        38
      ],
      [
        7,
        6
      ],
      [
        8,
        15
      ],
      [
        7,
        5
      ],
      [
        8,
        39
      ],
      [
        7,
        4
      ],
      [
        8,
        15
      ],
      [
        7,
        6
      ],
      [
        8,
        39
      ],
      [
        7,
        4
      ],
      [
        8,
        15
      ],
      [
        7,
        6
      ],
      [
        8,
        59
      ],
      [
        7,
        5
      ],
      [
        8,
        59
      ],
      [
        7,
        5
      ],
      [
        8,
        60
      ],
      [
        7,
        4
      ],
      [
        8,
        61
      ],
      [
        7,
        3
      ],
      [
        8,
        2943
      ],
      [
        7,
        1
      ],
      [
        8,
        62
      ],
      [
        7,
        2
      ],
      [
        8,
        61
      ],
      [
        7,
        3
      ],
      [
        8,
        60
      ],
      [
        7,
        4
      ],
      [
        8,
        59
      ],
      [
        7,
        5
      ],
      [
        8,
        59
      ],
      [
        7,
        5
      ],
      [
        8,
        59
      ],
      [
        7,
        5
      ],
      [
        8,
        59
      ],
      [
        7,
        5
      ],
      [
        8,
        61
      ],
      [
        7,
        3
      ],
      [
        8,
        192
      ]
    ],
    "hazard": [
      [
        0,
        4096
      ]
    ],
    "preserved": [
      [
        0,
        4096
      ]
    ],
    "region": [
      [
        1,
        4096
      ]
    ],
    "road": [
      [
        0,
        3390
      ],
      [
        1,
        2
      ],
      [
        0,
        57
      ],
      [
        1,
        7
      ],
      [
        0,
        54
      ],
      [
        1,
        10
      ],
      [
        0,
        49
      ],
      [
        1,
        15
      ],
      [
        0,
        46
      ],
      [
        1,
        13
      ],
      [
        0,
        46
      ],
      [
        1,
        15
      ],
      [
        0,
        46
      ],
      [
        1,
        13
      ],
      [
        0,
        46
      ],
      [
        1,
        15
      ],
      [
        0,
        46
      ],
      [
        1,
        13
      ],
      [
        0,
        46
      ],
      [
        1,
        15
      ],
      [
        0,
        46
      ],
      [
        1,
        13
      ],
      [
        0,
        46
      ],
      [
        1,
        15
      ],
      [
        0,
        32
      ]
    ],
    "surface": [
      [
        1,
        2432
      ],
      [
        2,
        1
      ],
      [
        1,
        63
      ],
      [
        2,
        2
      ],
      [
        1,
        62
      ],
      [
        2,
        2
      ],
      [
        1,
        62
      ],
      [
        2,
        2
      ],
      [
        1,
        62
      ],
      [
        2,
        1
      ],
      [
        1,
        701
      ],
      [
        20,
        2
      ],
      [
        1,
        57
      ],
      [
        20,
        7
      ],
      [
        1,
        54
      ],
      [
        20,
        10
      ],
      [
        1,
        49
      ],
      [
        20,
        15
      ],
      [
        1,
        46
      ],
      [
        20,
        13
      ],
      [
        1,
        46
      ],
      [
        20,
        15
      ],
      [
        1,
        46
      ],
      [
        20,
        13
      ],
      [
        1,
        46
      ],
      [
        20,
        15
      ],
      [
        1,
        46
      ],
      [
        20,
        13
      ],
      [
        1,
        46
      ],
      [
        20,
        15
      ],
      [
        1,
        46
      ],
      [
        20,
        13
      ],
      [
        1,
        46
      ],
      [
        20,
        15
      ],
      [
        1,
        32
      ]
    ],
    "walk": [
      [
        1,
        4096
      ]
    ]
  },
  "legend": {
    "biome": [
      "alpine_snow",
      "arid_coast",
      "ash_badland",
      "boreal_forest",
      "coastal_scrub",
      "freshwater_marsh",
      "frost_steppe",
      "karst_orchard",
      "lake",
      "mangrove",
      "moorland",
      "oasis",
      "ocean",
      "orchard",
      "peat_bog",
      "riverine",
      "ruin_field",
      "salt_flat",
      "temperate_mixed",
      "tidal_flat",
      "tropical_forest",
      "volcanic_steppe"
    ],
    "hazard": [
      "hz_crown_heat",
      "hz_crown_rot",
      "hz_crown_cold",
      "hz_frost_ridge",
      "hz_ember_gas",
      "hz_saffron_heat",
      "hz_verdant_spore",
      "hz_pearl_tide",
      "hz_ashwater_miasma",
      "hz_sunken_pressure"
    ],
    "region": [
      "r_ashen_crown",
      "r_frost_crown",
      "r_glasswind_coast",
      "r_ember_steppe",
      "r_saffron_coast",
      "r_verdant_fold",
      "r_pearl_mangroves",
      "r_amberwood",
      "r_mirrormere",
      "r_sunken_orchard",
      "r_ashwater_fen"
    ],
    "surface": [
      "grass",
      "moor",
      "gravel",
      "floor",
      "snow",
      "forest",
      "tundra",
      "sand",
      "water",
      "ash",
      "badland",
      "salt",
      "jungle",
      "karst",
      "marsh",
      "mangrove",
      "mud",
      "orchard",
      "bog",
      "road",
      "bridge",
      "legacy"
    ]
  },
  "origin": [
    320,
    256
  ],
  "schema": "soh.world.chunk.v1",
  "size": [
    64,
    64
  ],
  "tile_px": 16
}
